{
  "kind": "public_equity_investing_dashboard.v1",
  "mode": "comps_analysis",
  "layout": "single_page",
  "title": "ACME Software: public comps dashboard",
  "subtitle": "Synthetic strict-mode example for the Public Equity Investing dashboard pack.",
  "issuer": {
    "ticker": "ACME",
    "name": "ACME Software",
    "sector": "Software",
    "brand_dark_color": "#1f4b7a"
  },
  "metadata": {
    "freeze_time": "2026-05-18 09:00 ET",
    "source_posture": "Synthetic provider export plus company filing example",
    "citation_policy": "strict",
    "decision_context": "Whether ACME deserves a premium to vertical software peers.",
    "payload_stage": "production",
    "readiness_label": "Production fixture",
    "readiness_posture": "pm_ready"
  },
  "hero": {
    "eyebrow": "Comps analysis",
    "headline": "ACME screens at a premium to slower-growth vertical software peers",
    "dek": "The dashboard preserves peer logic, selected-multiple rationale, and source gaps.",
    "callout_label": "Core Debate",
    "callout": "The premium only works if ACME's retention and margin path remain above the peer median.",
    "citations": [
      "S1",
      "S2"
    ]
  },
  "snapshot": [
    {
      "label": "Comps Posture",
      "value": "Screen-grade",
      "detail": "Selected peer set requires live market refresh before decision use.",
      "status": "watch",
      "citations": [
        "S2"
      ]
    },
    {
      "label": "Selected Range",
      "value": "Eight to ten times NTM revenue",
      "detail": "Illustrative range based on the synthetic provider export.",
      "status": "watch",
      "citations": [
        "S2"
      ]
    }
  ],
  "tabs": [
    {
      "id": "overview",
      "label": "Overview",
      "modules": [
        {
          "type": "decision_box",
          "data": {
            "label": "PM read",
            "stance": "Watch",
            "summary": "ACME merits a modest premium only if retention and margin evidence survive a live data refresh.",
            "thesis_change": "Peer set looks usable, but market data freshness is the gating item.",
            "next_catalyst": "Refresh provider export before using the valuation range.",
            "citations": [
              "S1",
              "S2"
            ]
          }
        },
        {
          "type": "cards",
          "data": {
            "items": [
              {
                "title": "Peer logic",
                "body": "Closest peers share vertical software exposure, recurring revenue, and similar enterprise buyer cycles.",
                "citations": [
                  "S1"
                ]
              },
              {
                "title": "Main caveat",
                "body": "Live share price, net debt, and consensus estimates need refresh before the dashboard is decision-grade.",
                "citations": [
                  "S2"
                ]
              }
            ]
          }
        }
      ]
    },
    {
      "id": "valuation",
      "label": "Valuation",
      "modules": [
        {
          "type": "table",
          "data": {
            "columns": [
              "Company",
              "Ticker",
              "Business fit",
              "Revenue multiple",
              "Growth context",
              "Read"
            ],
            "rows": [
              {
                "Company": "ACME Software",
                "Ticker": "ACME",
                "Business fit": "Target issuer",
                "Revenue multiple": "Nine times",
                "Growth context": "Above peer median",
                "Read": "Premium requires retention support",
                "citations": [
                  "S1",
                  "S2"
                ]
              },
              {
                "Company": "PeerCo",
                "Ticker": "PEER",
                "Business fit": "Vertical software peer",
                "Revenue multiple": "Seven times",
                "Growth context": "Near peer median",
                "Read": "Useful anchor but lower growth",
                "citations": [
                  "S2"
                ]
              }
            ]
          }
        },
        {
          "type": "scenario_map",
          "data": {
            "cases": [
              {
                "label": "Downside",
                "status": "bear",
                "summary": "Premium compresses if retention fades or margin expansion stalls.",
                "citations": [
                  "S1",
                  "S2"
                ]
              },
              {
                "label": "Base",
                "status": "base",
                "summary": "ACME holds a modest premium to slower-growth peers.",
                "citations": [
                  "S2"
                ]
              },
              {
                "label": "Upside",
                "status": "bull",
                "summary": "Premium expands if retention and margin evidence both improve.",
                "citations": [
                  "S1"
                ]
              }
            ]
          }
        }
      ]
    },
    {
      "id": "refresh-gaps",
      "label": "Refresh Gaps",
      "modules": [
        {
          "type": "missing_evidence",
          "data": {
            "items": [
              "Live price, share count, net debt, and consensus export are required before decision use.",
              "Peer set should be rechecked against business-model and liquidity filters."
            ]
          }
        }
      ]
    }
  ],
  "sources": [
    {
      "id": "S1",
      "title": "ACME FY2026 Form 10-K excerpt",
      "url": "https://example.com/acme-10k",
      "as_of": "2026-03-01",
      "type": "filing",
      "status": "synthetic example",
      "excerpt": "Issuer operating profile and retention discussion."
    },
    {
      "id": "S2",
      "title": "Synthetic public comps provider export",
      "url": "https://example.com/provider-export",
      "as_of": "2026-05-18",
      "type": "market data",
      "status": "synthetic example",
      "excerpt": "Peer trading multiples and market-data placeholders."
    }
  ]
}
