{
  "kind": "public_equity_investing_dashboard.v1",
  "mode": "earnings_preview",
  "layout": "single_page",
  "title": "ExampleCo: Production Dashboard",
  "issuer": {
    "ticker": "EXCO",
    "name": "ExampleCo",
    "exchange": "NYSE",
    "sector": "Example sector",
    "accent_color": "#245f5a"
  },
  "metadata": {
    "payload_stage": "production",
    "freeze_time": "2026-05-18 09:00 ET",
    "source_posture": "Synthetic issuer release reviewed for validator fixture.",
    "readiness_label": "PM-ready fixture",
    "readiness_posture": "pm_ready",
    "citation_policy": "strict",
    "decision_context": "Whether the pre-print setup is ready for a PM read."
  },
  "hero": {
    "eyebrow": "Production dashboard",
    "headline": "ExampleCo: source-visible PM setup",
    "dek": "This fixture carries the complete production metadata contract.",
    "callout_label": "Core Debate",
    "callout": "Whether the setup is actionable for review.",
    "citations": ["S1"]
  },
  "snapshot": [
    {
      "label": "Event",
      "value": "May 20, 2026",
      "detail": "Issuer release fixture.",
      "status": "good",
      "citations": ["S1"]
    }
  ],
  "tabs": [
    {
      "id": "overview",
      "label": "Overview",
      "modules": [
        {
          "type": "decision_box",
          "title": "PM View",
          "data": {
            "stance": "Ready for review",
            "summary": "Production metadata, source ledger, and point-of-use citations are present.",
            "citations": ["S1"]
          }
        },
        {
          "type": "missing_evidence",
          "title": "Missing Evidence",
          "data": {
            "items": [
              "No missing evidence in this synthetic validator fixture."
            ]
          }
        }
      ]
    }
  ],
  "sources": [
    {
      "id": "S1",
      "title": "ExampleCo release fixture",
      "type": "Synthetic source",
      "status": "Reviewed fixture",
      "as_of": "2026-05-18",
      "excerpt": "Source-visible production validation fixture."
    }
  ]
}
