{
  "kind": "public_equity_investing_dashboard.v1",
  "mode": "hero_citation_test",
  "layout": "single_page",
  "title": "Hero Citation Test Dashboard",
  "subtitle": "Synthetic strict-mode dashboard for hero citation rendering.",
  "issuer": {
    "ticker": "HERO",
    "name": "Hero Citation Co.",
    "sector": "Testing",
    "brand_dark_color": "#1f4b7a"
  },
  "metadata": {
    "freeze_time": "2026-05-18 09:00 ET",
    "source_posture": "Synthetic source ledger for renderer regression coverage",
    "citation_policy": "strict",
    "decision_context": "Hero citations should remain visible.",
    "payload_stage": "production",
    "readiness_label": "Production fixture",
    "readiness_posture": "pm_ready"
  },
  "hero": {
    "eyebrow": "Renderer QA",
    "headline": "Hero citations remain visible",
    "dek": "The hero dek should append a source chip when citations are provided.",
    "callout_label": "Numeric Callout",
    "callout": "Revenue grew 24.5% in the cited period.",
    "citations": [
      "S1"
    ]
  },
  "snapshot": [
    {
      "label": "Citation State",
      "value": "Visible",
      "detail": "Hero citations should render in the masthead.",
      "status": "good",
      "citations": [
        "S1"
      ]
    }
  ],
  "tabs": [
    {
      "id": "overview",
      "label": "Overview",
      "modules": [
        {
          "type": "decision_box",
          "data": {
            "label": "QA read",
            "stance": "Good",
            "summary": "Hero citation rendering is the behavior under test.",
            "citations": [
              "S1"
            ]
          }
        },
        {
          "type": "missing_evidence",
          "data": {
            "items": [
              "No missing evidence; this module is included so sample coverage preserves the standard dashboard QA shape."
            ]
          }
        }
      ]
    }
  ],
  "sources": [
    {
      "id": "S1",
      "title": "Synthetic hero citation source",
      "url": "https://example.com/hero-citation",
      "as_of": "2026-05-18",
      "type": "test source",
      "status": "synthetic example",
      "excerpt": "Supports hero dek and callout citation rendering."
    }
  ]
}
