{
  "kind": "public_equity_investing_dashboard.v1",
  "mode": "scenario_sensitivity",
  "layout": "single_page",
  "title": "ACME Scenario Sensitivity Dashboard",
  "subtitle": "Synthetic strict-mode example for public-equity scenario skew.",
  "issuer": {
    "ticker": "ACME",
    "name": "ACME Software"
  },
  "metadata": {
    "freeze_time": "2026-05-18 09:00 ET",
    "source_posture": "Synthetic user-provided scenario inputs",
    "citation_policy": "strict",
    "decision_context": "Does probability-weighted upside clear the hurdle after downside and evidence quality?",
    "payload_stage": "production",
    "readiness_label": "Production fixture",
    "readiness_posture": "senior_review_ready"
  },
  "hero": {
    "eyebrow": "Scenario sensitivity",
    "headline": "Expected return clears the hurdle, but downside skew still governs action",
    "dek": "The dashboard keeps raw tables as support artifacts and surfaces the PM decision layer.",
    "callout_label": "PM Action",
    "callout": "Hold / wait for proof until probability support and model tie-out are refreshed.",
    "citations": ["S1"]
  },
  "snapshot": [
    {
      "label": "Current price",
      "value": "$100",
      "detail": "Synthetic spot anchor.",
      "status": "neutral",
      "citations": ["S1"]
    },
    {
      "label": "Probability-weighted value",
      "value": "$116",
      "detail": "Weighted by supplied bull/base/bear probabilities.",
      "status": "watch",
      "citations": ["S1"]
    },
    {
      "label": "Expected return vs hurdle",
      "value": "+4%",
      "detail": "Expected return less 12% hurdle.",
      "status": "watch",
      "citations": ["S1"]
    },
    {
      "label": "Downside/upside ratio",
      "value": "0.45x",
      "detail": "Downside is acceptable but not trivial.",
      "status": "risk",
      "citations": ["S1"]
    },
    {
      "label": "Break-even probability",
      "value": "31%",
      "detail": "Probability required to justify spot.",
      "status": "neutral",
      "citations": ["S1"]
    },
    {
      "label": "Skew label",
      "value": "optical upside / needs proof",
      "detail": "Upside is visible but source posture caps conviction.",
      "status": "watch",
      "citations": ["S1"]
    },
    {
      "label": "PM action",
      "value": "hold / wait for proof",
      "detail": "Model tie-out and probability support are gating items.",
      "status": "neutral",
      "citations": ["S1"]
    }
  ],
  "tabs": [
    {
      "id": "pm-decision",
      "label": "PM Decision",
      "modules": [
        {
          "type": "decision_box",
          "data": {
            "label": "Scenario read",
            "stance": "Hold / wait for proof",
            "summary": "Probability-weighted value is $116 versus $100 spot, but the action remains proof-gated.",
            "stock_skew": "Optical upside / needs proof.",
            "citations": ["S1"]
          }
        },
        {
          "type": "metric_tiles",
          "data": {
            "items": [
              {
                "label": "Expected return vs hurdle",
                "value": "+4%",
                "detail": "Synthetic expected return less 12% hurdle.",
                "citations": ["S1"]
              },
              {
                "label": "Break-even probability",
                "value": "31%",
                "detail": "Probability needed to justify spot.",
                "citations": ["S1"]
              }
            ]
          }
        }
      ]
    },
    {
      "id": "scenario-map",
      "label": "Scenario Map",
      "modules": [
        {
          "type": "scenario_map",
          "data": {
            "cases": [
              {
                "label": "Bull",
                "status": "bull",
                "summary": "Bull value is $140 on estimate upside and multiple support.",
                "citations": ["S1"]
              },
              {
                "label": "Base",
                "status": "base",
                "summary": "Base value is $118 with moderate estimate revision support.",
                "citations": ["S1"]
              },
              {
                "label": "Bear",
                "status": "bear",
                "summary": "Bear value is $82 if growth decelerates and multiple support fades.",
                "citations": ["S1"]
              }
            ]
          }
        },
        {
          "type": "table",
          "data": {
            "columns": ["Scenario", "Value", "Return", "Skew", "Action"],
            "rows": [
              {
                "Scenario": "Probability weighted",
                "Value": "$116",
                "Return": "+16%",
                "Skew": "optical upside / needs proof",
                "Action": "hold / wait for proof",
                "citations": ["S1"]
              }
            ]
          }
        }
      ]
    },
    {
      "id": "evidence-and-qa",
      "label": "Evidence & QA",
      "modules": [
        {
          "type": "source_list",
          "data": {
            "sources": [
              {
                "id": "S1",
                "title": "Synthetic scenario packet",
                "as_of": "2026-05-18",
                "type": "user/model input",
                "status": "synthetic example",
                "excerpt": "Synthetic spot price, scenario values, probabilities, and hurdle inputs."
              }
            ]
          }
        },
        {
          "type": "missing_evidence",
          "data": {
            "items": [
              "Refresh current price, probability support, model tie-out, and source freshness before sizing or portfolio action."
            ]
          }
        }
      ]
    }
  ],
  "sources": [
    {
      "id": "S1",
      "title": "Synthetic scenario packet",
      "as_of": "2026-05-18",
      "type": "user/model input",
      "status": "synthetic example",
      "excerpt": "Synthetic spot price, scenario values, probabilities, and hurdle inputs."
    }
  ]
}
